;Collettivo selezionato;business and economics/economia e gestione di impresa - già economia e marketing (L-18);economia aziendale (17);economia aziendale (L-18);economia dei mercati e dei sistemi turistici (28);economia del turismo (17)(1) ;economia del turismo (L-33);economia delle imprese cooperative e delle organizzazioni non profit (28)(1) ;economia delle imprese cooperative e delle organizzazioni non-profit (28)(1) ;economia dell'impresa (L-18);economia e amministrazione delle imprese (17);economia e commercio - sede di Bologna (17)(1) ;economia e commercio - sede di Forlì (17);economia e commercio (L-18);economia e diritto (28)(1) ;economia e diritto (L-33)(1) ;economia e finanza (28)(1) ;economia e gestione aziendale (17);economia e gestione delle imprese (17);economia e management (28)(1) ;economia e marketing (17)(1) ;economia e professione (17);economia e professione (L-18);economia, mercati e istituzioni (L-33);economics and finance / economia e finanza (L-33);finanza, assicurazioni e impresa (L-41);management e marketing - già economia e gestione delle imprese (L-18);scienze statistiche (L-41);statistica, impresa e mercati (37)(1) 
Punteggio degli esami (medie) ;24,8;26;22;24,7;22,4;*;23,7;*;*;24,2;23,2;*;22,8;25,1;*;*;*;23,3;23,5;*;*;22,4;23,3;24,4;24,6;26,9;25,7;26,4;*
Voto di laurea (medie) ;95,7;101,5;81,8;95,5;81,6;*;90,6;*;*;93;87,6;*;85;96,6;*;*;*;86,8;87,7;*;*;83,1;86,7;93;94,8;105,3;99,9;102,9;*
Studi in corso %;66,6;82,1;-;67;-;*;58,3;*;*;63,1;-;*;-;68,8;*;*;*;-;-;*;*;-;-;71,1;68,4;78,8;84,1;79,6;*
Durata degli studi (medie, in anni) ;3,8;3,2;10,2;3,5;8,7;*;3,8;*;*;3,6;10,3;*;9;3,6;*;*;*;8,5;9,5;*;*;9,8;6;3,5;3,4;3,2;3,1;3,3;*
Ritardo alla laurea (medie, in anni) ;0,7;0,3;6,8;0,4;5,2;*;0,5;*;*;0,4;6,8;*;5,5;0,5;*;*;*;5;6,1;*;*;6,3;2,5;0,4;0,3;0,2;0,2;0,3;*
Hanno svolto periodi di studio all'estero nel corso degli studi universitari (%);17,7;56,3;-;21,4;-;*;10,4;*;*;5,5;25;*;-;7,4;*;*;*;-;-;*;*;14,3;-;24,4;17;6,1;25,2;24,4;*
Hanno svolto tirocini/stage o lavoro riconosciuti dal corso di laurea (%);48,8;29,1;7,7;10,4;100;*;94,8;*;*;92,5;75;*;83,3;92,1;*;*;*;80;100;*;*;85,7;83,3;2,4;9,7;54,5;32,8;21,1;*
Soddisfazione decisamente sì %;31,1;23,3;30,8;19,8;50;*;21,5;*;*;34,9;25;*;33,3;33,1;*;*;*;40;60;*;*;42,9;16,7;23,2;29;48,5;36,6;57,8;*
